[
  {
    "id": "a2a-protocol",
    "name": "A2A Protocol",
    "url": "https://a2a-protocol.org/",
    "repo": "https://github.com/a2aproject/A2A",
    "category": "standards",
    "chain": "none",
    "description": "Agent2Agent, an open protocol for communication and interoperability between opaque agentic applications.",
    "status": "active",
    "added": "2026-10-10"
  },
  {
    "id": "agent-skills",
    "name": "Agent Skills",
    "url": "https://agentskills.io/",
    "repo": null,
    "category": "standards",
    "chain": "none",
    "description": "An open format for packaging reusable skills that agents can discover and load on demand.",
    "status": "active",
    "added": "2026-10-10"
  },
  {
    "id": "agents-md",
    "name": "AGENTS.md",
    "url": "https://agents.md/",
    "repo": null,
    "category": "standards",
    "chain": "none",
    "description": "A simple, open format of project instructions that gives coding agents context about a repository.",
    "status": "active",
    "added": "2026-10-10"
  },
  {
    "id": "ai-robots-txt",
    "name": "ai.robots.txt",
    "url": "https://github.com/ai-robots-txt/ai.robots.txt",
    "repo": "https://github.com/ai-robots-txt/ai.robots.txt",
    "category": "standards",
    "chain": "none",
    "description": "A maintained list of AI agents and crawlers, with ready-made robots.txt rules for sites that want to manage them.",
    "status": "active",
    "added": "2026-10-10"
  },
  {
    "id": "llms-txt",
    "name": "llms.txt",
    "url": "https://llmstxt.org/",
    "repo": "https://github.com/AnswerDotAI/llms-txt",
    "category": "standards",
    "chain": "none",
    "description": "A proposal from Jeremy Howard to publish a Markdown file at a site root that gives LLMs a curated guide to its content.",
    "status": "active",
    "added": "2026-10-10"
  },
  {
    "id": "model-context-protocol",
    "name": "Model Context Protocol",
    "url": "https://modelcontextprotocol.io/",
    "repo": "https://github.com/modelcontextprotocol/modelcontextprotocol",
    "category": "standards",
    "chain": "none",
    "description": "The open protocol for connecting AI applications to tools, data sources, and workflows.",
    "status": "active",
    "added": "2026-10-10"
  },
  {
    "id": "nlweb",
    "name": "NLWeb",
    "url": "https://github.com/nlweb-ai/NLWeb",
    "repo": "https://github.com/nlweb-ai/NLWeb",
    "category": "standards",
    "chain": "none",
    "description": "The reference implementation of NLWeb, which lets sites offer natural language interfaces to their own content.",
    "status": "active",
    "added": "2026-10-10"
  },
  {
    "id": "robots-exclusion-protocol-rfc-9309",
    "name": "Robots Exclusion Protocol (RFC 9309)",
    "url": "https://www.rfc-editor.org/info/rfc9309/",
    "repo": null,
    "category": "standards",
    "chain": "none",
    "description": "The IETF standard that formalizes robots.txt rules for crawlers and automated clients.",
    "status": "active",
    "added": "2026-10-10"
  },
  {
    "id": "web-bot-auth",
    "name": "Web Bot Auth",
    "url": "https://www.webbotauth.org/",
    "repo": "https://github.com/cloudflare/web-bot-auth",
    "category": "standards",
    "chain": "none",
    "description": "A neutral directory and signing scheme for authenticated bots, built on signed HTTP requests.",
    "status": "early",
    "added": "2026-10-10"
  },
  {
    "id": "webmcp-in-chrome",
    "name": "WebMCP in Chrome",
    "url": "https://developer.chrome.com/docs/ai/webmcp",
    "repo": null,
    "category": "standards",
    "chain": "none",
    "description": "Chrome documentation for WebMCP, covering imperative and declarative tools and the origin trial.",
    "status": "early",
    "added": "2026-10-10"
  },
  {
    "id": "webmcp-specification",
    "name": "WebMCP Specification",
    "url": "https://webmachinelearning.github.io/webmcp/",
    "repo": "https://github.com/webmachinelearning/webmcp",
    "category": "standards",
    "chain": "none",
    "description": "A draft Web Machine Learning Community Group API that lets web apps offer JavaScript tools to AI agents.",
    "status": "early",
    "added": "2026-10-10"
  },
  {
    "id": "early-webmcp-proposal",
    "name": "Early WebMCP Proposal",
    "url": "https://github.com/jasonjmcghee/WebMCP",
    "repo": "https://github.com/jasonjmcghee/WebMCP",
    "category": "in-page-tools",
    "chain": "none",
    "description": "An early WebMCP proposal and implementation that later fed into the W3C community group work.",
    "status": "archived",
    "added": "2026-10-10"
  },
  {
    "id": "mcp-typescript-sdk",
    "name": "MCP TypeScript SDK",
    "url": "https://github.com/modelcontextprotocol/typescript-sdk",
    "repo": "https://github.com/modelcontextprotocol/typescript-sdk",
    "category": "in-page-tools",
    "chain": "none",
    "description": "The official TypeScript SDK for building Model Context Protocol servers and clients.",
    "status": "active",
    "added": "2026-10-10"
  },
  {
    "id": "mcp-b",
    "name": "MCP-B",
    "url": "https://mcp-b.ai/",
    "repo": "https://github.com/WebMCP-org/npm-packages",
    "category": "in-page-tools",
    "chain": "none",
    "description": "Open-source WebMCP packages and a browser extension for publishing and calling tools on the web.",
    "status": "active",
    "added": "2026-10-10"
  },
  {
    "id": "mcp-use",
    "name": "mcp-use",
    "url": "https://github.com/mcp-use/mcp-use",
    "repo": "https://github.com/mcp-use/mcp-use",
    "category": "in-page-tools",
    "chain": "none",
    "description": "A full-stack MCP framework for building MCP apps for ChatGPT and Claude and MCP servers for agents.",
    "status": "active",
    "added": "2026-10-10"
  },
  {
    "id": "webllm",
    "name": "WebLLM",
    "url": "https://github.com/mlc-ai/web-llm",
    "repo": "https://github.com/mlc-ai/web-llm",
    "category": "in-page-tools",
    "chain": "none",
    "description": "A high-performance in-browser LLM inference engine for running models locally inside a web page.",
    "status": "active",
    "added": "2026-10-10"
  },
  {
    "id": "webmcp-tools",
    "name": "WebMCP Tools",
    "url": "https://github.com/GoogleChromeLabs/webmcp-tools",
    "repo": "https://github.com/GoogleChromeLabs/webmcp-tools",
    "category": "in-page-tools",
    "chain": "none",
    "description": "Developer utilities and demos from Chrome Labs that support adoption of the WebMCP API.",
    "status": "active",
    "added": "2026-10-10"
  },
  {
    "id": "agent-browser",
    "name": "agent-browser",
    "url": "https://agent-browser.dev/",
    "repo": "https://github.com/vercel-labs/agent-browser",
    "category": "browser-use-frameworks",
    "chain": "none",
    "description": "A browser automation CLI built for AI agents.",
    "status": "active",
    "added": "2026-10-10"
  },
  {
    "id": "agentql",
    "name": "AgentQL",
    "url": "https://www.agentql.com/",
    "repo": "https://github.com/tinyfish-io/agentql",
    "category": "browser-use-frameworks",
    "chain": "none",
    "description": "A query language and Playwright integration for locating elements and extracting data from any page.",
    "status": "active",
    "added": "2026-10-10"
  },
  {
    "id": "browser-use",
    "name": "Browser Use",
    "url": "https://browser-use.com/",
    "repo": "https://github.com/browser-use/browser-use",
    "category": "browser-use-frameworks",
    "chain": "none",
    "description": "An open-source library that lets AI agents use the browser.",
    "status": "active",
    "added": "2026-10-10"
  },
  {
    "id": "browser-use-web-ui",
    "name": "Browser Use Web UI",
    "url": "https://github.com/browser-use/web-ui",
    "repo": "https://github.com/browser-use/web-ui",
    "category": "browser-use-frameworks",
    "chain": "none",
    "description": "A web interface for running Browser Use agents in your browser.",
    "status": "active",
    "added": "2026-10-10"
  },
  {
    "id": "hyperagent",
    "name": "HyperAgent",
    "url": "https://github.com/hyperbrowserai/HyperAgent",
    "repo": "https://github.com/hyperbrowserai/HyperAgent",
    "category": "browser-use-frameworks",
    "chain": "none",
    "description": "An AI browser automation framework from the Hyperbrowser team.",
    "status": "active",
    "added": "2026-10-10"
  },
  {
    "id": "lavague",
    "name": "LaVague",
    "url": "https://github.com/lavague-ai/LaVague",
    "repo": "https://github.com/lavague-ai/LaVague",
    "category": "browser-use-frameworks",
    "chain": "none",
    "description": "A Large Action Model framework for developing AI web agents.",
    "status": "active",
    "added": "2026-10-10"
  },
  {
    "id": "midscene-js",
    "name": "Midscene.js",
    "url": "https://github.com/web-infra-dev/midscene",
    "repo": "https://github.com/web-infra-dev/midscene",
    "category": "browser-use-frameworks",
    "chain": "none",
    "description": "A vision-driven framework that lets you control web and other interfaces in natural language.",
    "status": "active",
    "added": "2026-10-10"
  },
  {
    "id": "nanobrowser",
    "name": "Nanobrowser",
    "url": "https://github.com/nanobrowser/nanobrowser",
    "repo": "https://github.com/nanobrowser/nanobrowser",
    "category": "browser-use-frameworks",
    "chain": "none",
    "description": "An open-source Chrome extension that runs multi-agent web automation workflows with your own LLM API key.",
    "status": "active",
    "added": "2026-10-10"
  },
  {
    "id": "open-operator",
    "name": "Open Operator",
    "url": "https://github.com/browserbase/open-operator",
    "repo": "https://github.com/browserbase/open-operator",
    "category": "browser-use-frameworks",
    "chain": "none",
    "description": "A template for building web agents with Stagehand on Browserbase.",
    "status": "archived",
    "added": "2026-10-10"
  },
  {
    "id": "skyvern",